{
  "schemaVersion": "archcontext.review-challenge/v2",
  "challengeId": "chal_20260620_org",
  "installationId": 10001,
  "repositoryId": 20002,
  "pullRequestNumber": 42,
  "headSha": "aaaaaaaaaaaaaaaaaaaaaaaaaaaaaaaaaaaaaaaa",
  "baseSha": "bbbbbbbbbbbbbbbbbbbbbbbbbbbbbbbbbbbbbbbb",
  "nonce": "nonce_base64url_org",
  "requiredTrust": "organization",
  "policyProfileId": "policy.organization",
  "createdAt": "2026-06-20T09:00:00Z",
  "expiresAt": "2026-06-20T09:15:00Z",
  "status": "LEASED"
}
